{
  "protocol": "commercial",
  "version": "1.1.0",
  "verb": "ship",
  "request_id": "shipreq-002",
  "requested_at": "2026-03-19T12:15:00Z",
  "merchant": {
    "role": "merchant",
    "id": "merchant.example",
    "kind": "organization"
  },
  "provider": {
    "role": "provider",
    "id": "warehouse.example",
    "kind": "service"
  },
  "purchase_ref": {
    "type": "purchase",
    "id": "purchase-3002"
  },
  "settlement_ref": {
    "type": "settlement",
    "id": "settle-3002"
  },
  "fulfillment_ref": {
    "type": "fulfillment",
    "id": "fulfillment-3002"
  },
  "items": [
    {
      "sku": "bundle-002",
      "quantity": 2
    }
  ],
  "destination": {
    "country_code": "CA",
    "postal_code": "M5V1E3",
    "locality": "Toronto"
  },
  "service_level": "standard"
}
